League,Fixture,Tip,Score,Code,Result
Brazil: Paulista,Velo Clube vs Corinthians,AWAY DC,Not Yet,ondlvlyp331348196,Not Yet
Belgium: Jupiler Pro League,Genk vs Cercle Brugge KSV,HOME DC,Not Yet,azianzdk111358297,Not Yet
Italy: Serie C - Group C,Audace Cerignola vs Monopoli,HOME DC,Not Yet,qwgqnbgc213706088,Not Yet
Spain: Segunda Rfef - Group 4,CD Extremadura vs Puente Genil,HOME DC,Not Yet,riizjldb129454072,Not Yet
Italy: Serie C - Group A,Alcione Milano vs Dolomiti Bellunesi,HOME DC,Not Yet,xxrwjnyw284355870,Not Yet
