ID,League,Fixture,Tip,Score,Match Date,Result,Code
145638,England: National League North,Buxton vs King’s Lynn,HOME DC,?:?,2026-02-24,?,udhjfxes234534415
145639,Indonesia: Super League,FC Bhayangkara vs Semen Padang,HOME DC,?:?,2026-02-24,?,souzqugk173033599
145643,England: National League,Scunthorpe vs York City,AWAY DC,?:?,2026-02-24,?,syvwjrao5610056
145650,England: National League North,Curzon Ashton vs Darlington,AWAY DC,?:?,2026-02-24,?,ommfnhro296058571
145653,Europe: Champions League - Play Offs,Bayer Leverkusen vs Olympiacos Piraeus,HOME DC,?:?,2026-02-24,?,tfnoohzn177058202
145657,Portugal: Liga Revelacao U23 - Losers Stage,Rio Ave U23 vs Vizela U23,HOME DC,?:?,2026-02-24,?,zyzkcmqy31940858
145660,India - Super League,Odisha vs Inter Kashi,12,,2026-02-24,?,lluptoky3758007
145676,India - Super League,Odisha vs Inter Kashi,12,,2026-02-24,?,lgzpynkw233907852
145707,UCL,Bayer Leverkusen vs Olympiacos FC,Over 1.5,?:?,2026-02-24,?,yibgfetl33626477
145708,Saudi Arabia: Saudi Professional League,Al Khaleej vs Al Kholood,HOME DC,?:?,2026-02-24,?,cdfsqape157278126
145710,England: National League,Wealdstone vs Brackley Town,HOME DC,?:?,2026-02-24,?,qjsduxdz225610509
145711,England: Southern League Premier Central,Alvechurch vs Real Bedford,AWAY DC,?:?,2026-02-24,?,kxxxbfzf101338205
145712,Portugal: Liga Revelacao U23 - Losers Stage,Gil Vicente U23 vs Portimonense U23,HOME DC,?:?,2026-02-24,?,zsnqecco169999896
145713,Romania: Liga 2,Concordia vs Corvinul,AWAY DC,?:?,2026-02-24,?,oyhuorum194426792
145714,England: Southern League Premier Central,Banbury vs Stratford,HOME DC,?:?,2026-02-24,?,esalyesi242430563
145715,Poland: Division 2,Zaglebie Sosnowiec vs Sandecja Nowy S.,HOME DC,?:?,2026-02-24,?,hnmijesw51680908
145719,England: National League,Scunthorpe vs York City,AWAY DC,?:?,2026-02-24,?,lardplhp13118035
145720,England: Championship,West Brom vs Charlton,HOME DC,?:?,2026-02-24,?,rzhvzlfs40013076
145722,Saudi Arabia: Division 1,Al Bukiryah vs Al Jandal,HOME DC,?:?,2026-02-24,?,fmrctxln138636341
145723,England: Championship,Wrexham vs Portsmouth,HOME DC,?:?,2026-02-24,?,uhkkgjku295015506
145725,Scotland: League Two,Stirling vs Annan,AWAY DC,?:?,2026-02-24,?,hipvqdlq145244140
145726,England: National League North,Oxford City vs AFC Telford,AWAY DC,?:?,2026-02-24,?,kglrsmrp289726993
145728,England: Southern League Premier Central,Banbury vs Stratford,HOME DC,?:?,2026-02-24,?,nqkdwfxe67560216
145730,Europe: Uefa Youth League - Play Offs,Eintracht Frankfurt U19 vs Sporting CP U19,AWAY DC,?:?,2026-02-24,?,evxphpkq126845373
145776,UCL,Newcastle United vs Qarabag FK,Over 1.5,?:?,2026-02-24,?,kybqrcmi281928734
145777,UCL,Inter Milan vs Bodo Glimt,Over 1.5,?:?,2026-02-24,?,rzschwzp289911165
145778,England: National League,Southend vs Boreham Wood,HOME DC,?:?,2026-02-24,?,mepzdnsi82074834
145779,England: National League North,Curzon Ashton vs Darlington,AWAY DC,?:?,2026-02-24,?,bkthrspi32104703
145780,England: Isthmian League Premier Division,Dulwich Hamlet vs Chatham,AWAY DC,?:?,2026-02-24,?,rhcywisn322281953
145781,England: Professional Development League,Watford U21 vs Brentford U21,AWAY DC,?:?,2026-02-24,?,vvfxlssn208136538
145782,Europe: Uefa Youth League - Play Offs,Eintracht Frankfurt U19 vs Sporting CP U19,AWAY DC,?:?,2026-02-24,?,jukzqfdu29848606
145783,England: Championship,West Brom vs Charlton,HOME DC,?:?,2026-02-24,?,vbxqszhk260832566
145784,Scotland: League Two,Dumbarton vs Clyde,AWAY DC,?:?,2026-02-24,?,euuazomm286025045
145785,Europe: Champions League - Play Offs,Bayer Leverkusen vs Olympiacos Piraeus,HOME DC,?:?,2026-02-24,?,givtdvwt5679646
145786,Argentina: Liga Profesional - Apertura,Platense vs Defensa y Justicia,HOME DC,?:?,2026-02-24,?,dkkeoblz237836833
145787,England: Championship,Wrexham vs Portsmouth,HOME DC,?:?,2026-02-24,?,zgqfbfhx210768882
145788,Poland: Division 2,Zaglebie Sosnowiec vs Sandecja Nowy S.,HOME DC,?:?,2026-02-24,?,zuedbpqk301695980
145789,England: Southern League Premier South,Hanwell Town vs Plymouth Parkway,HOME DC,?:?,2026-02-24,?,uyqzddmc156827520
145790,England: National League,Southend vs Boreham Wood,HOME DC,?:?,2026-02-24,?,rkjwofth256951067
145791,Wales: Cymru South,Ammanford vs Aberystwyth,HOME DC,?:?,2026-02-24,?,hgipmbpv46941641
145792,Saudi Arabia: Saudi Professional League,Al Khaleej vs Al Kholood,HOME DC,?:?,2026-02-24,?,zpoimtgp135052603
145793,England: National League South,Worthing vs Torquay,HOME DC,?:?,2026-02-24,?,djiflvcr136234769
145794,England: National League South,Dover vs Hornchurch,AWAY DC,?:?,2026-02-24,?,oqjvbwyc7112755
145795,England: National League,Wealdstone vs Brackley Town,HOME DC,?:?,2026-02-24,?,nofaadxh22597970
145796,Romania: Liga 2,Concordia vs Corvinul,AWAY DC,?:?,2026-02-24,?,jypfmbzh26489637
145797,England: National League North,Buxton vs King’s Lynn,HOME DC,?:?,2026-02-24,?,fsytfnqj43232235
145798,Argentina: Liga Profesional - Apertura,Platense vs Defensa y Justicia,HOME DC,?:?,2026-02-24,?,tygsynkw90077213
145799,England: League Two,Accrington vs Barnet,AWAY DC,?:?,2026-02-24,?,vrrghmkq187376913
145800,England: Southern League Premier South,Tiverton vs Dorchester,AWAY DC,?:?,2026-02-24,?,ezcfslti219320526
145801,Scotland: League Two,Dumbarton vs Clyde,AWAY DC,?:?,2026-02-24,?,dqtqxuah265044273
145802,England: Southern League Premier Central,Alvechurch vs Real Bedford,AWAY DC,?:?,2026-02-24,?,nepkjbgs303411757
145803,England - EFL Trophy,Luton Town vs Plymouth Argyle,12,,2026-02-24,?,rohirsvl143892124
145804,Egypt - Premier,Ghazl El Mahalla vs Pyramids,X2,,2026-02-24,?,ninaivwm244957010
145805,Scotland - Challenge Cup,Ayr United vs Inverness,12,,2026-02-24,?,anevghgf163816248
145806,England - Championship,Swansea City vs Preston North End,12,,2026-02-24,?,yqrbcqko157316979
145807,England - Championship,Watford vs Ipswich Town,12,,2026-02-24,?,fwsmptge230173052
145808,England - Championship,West Bromwich vs Charlton,12,,2026-02-24,?,dqqzzrpm112417541
145809,England - League Two,Accrington vs Barnet,12,,2026-02-24,?,gdtzinga6483907
145810,England - National League,Southend Utd vs Boreham Wood,12,,2026-02-24,?,gmeinvhu278261174
145811,England - National League,Wealdstone vs Brackley Town,12,,2026-02-24,?,yotihhih324810590
145812,North. Ireland - Premiership,Larne vs Linfield,12,,2026-02-24,?,hrntrwno84139025
145813,Argentina - Liga Profesional,Platense vs Def. Y Justicia,1X,,2026-02-24,?,wybkszkw8146911
145814,England - Championship,Southampton vs QPR,1X,,2026-02-24,?,paphqalu196184249
145815,Argentina - Liga Profesional,Central Cordoba vs Talleres,X2,,2026-02-24,?,ojtiqpap84964087
145816,Vietnam - V.League 1,Thanh Hoa vs Cong An Ha Noi,2,,2026-02-24,?,mfoeuxiq133275516
145817,Indonesia - Super League,Malut United vs Persija Jakarta,12,,2026-02-24,?,zrwslqgn281686299
145818,South Africa - PSL,AmaZulu Durban vs Mamelodi Sund.,X2,,2026-02-24,?,wlowxhyi17533156
145819,Champions League,Atletico Madrid vs Club Brugge,1,,2026-02-24,?,idyonpdj74034761
145820,England - EFL Trophy,Luton Town vs Plymouth Argyle,12,,2026-02-24,?,ijyqgneg278658994
145821,Netherlands - Eerste Divisie,Cambuur vs FC Eindhoven,1,,2026-02-24,?,vhygldxm179335212
145822,Saudi Arabia - Professional League,Al-Hazem vs Al-Ittihad,2,,2026-02-24,?,bfccvxjo195114415
145823,Saudi Arabia - Professional League,Al-Taawoun vs Al-Hilal Riyadh,2,,2026-02-24,?,fnkylprc133940134
145824,Egypt - Premier,Cer. Cleopatra vs El Ismaily,1,,2026-02-24,?,tswfasps318014145
145825,Egypt - Premier,Ghazl El Mahalla vs Pyramids,X2,,2026-02-24,?,hhufsqje101417090
145826,Egypt - Premier,ZED FC vs Zamalek,12,,2026-02-24,?,mnkiqkiw71299686
145827,Scotland - Challenge Cup,Ayr United vs Inverness,12,,2026-02-24,?,nvhakcpz255060460
145828,England - Championship,Hull City vs Derby County,1X,,2026-02-24,?,pwozdwwu270854059
145829,England - Championship,Middlesbrough vs Leicester City,1,,2026-02-24,?,awtgslhq129433364
145830,England - Championship,Swansea City vs Preston North End,12,,2026-02-24,?,tewtbttx5119050
145831,England - Championship,Watford vs Ipswich Town,12,,2026-02-24,?,sfbidaqm62295701
145832,England - Championship,West Bromwich vs Charlton,12,,2026-02-24,?,ngoupqtn74405838
145833,England - Championship,Wrexham vs Portsmouth,1X,,2026-02-24,?,relmmnah27979720
145834,England - League Two,Accrington vs Barnet,12,,2026-02-24,?,etxzbcix305707528
145835,England - National League,Southend Utd vs Boreham Wood,12,,2026-02-24,?,yybvsdpa56568290
145836,England - National League,Tamworth vs Altrincham,1X,,2026-02-24,?,kmizngqo8513640
145837,England - National League,Wealdstone vs Brackley Town,12,,2026-02-24,?,deitmlso289488702
145838,North. Ireland - Premiership,Larne vs Linfield,12,,2026-02-24,?,rwwsgdlu103751501
145839,Scotland - Premiership,Dundee Utd vs Aberdeen,1X,,2026-02-24,?,xseugydn307919195
145840,Scotland - Championship,Dunfermline vs Partick Thistle,X2,,2026-02-24,?,zgueujof81809691
145841,UCL,Atletico Madrid vs Club Brugge,Over 1.5,?:?,2026-02-24,?,ndrnsfup158113725
145842,NED D2,SC Cambuur vs FC Eindhoven,Over 1.5,?:?,2026-02-24,?,zyuowfme210484965
145843,NED D2,Willem II vs ADO Den Haag,Over 1.5,?:?,2026-02-24,?,wzklltnp309503035
145844,EFL Trophy,Luton Town vs Plymouth Argyle,Over 1.5,?:?,2026-02-24,?,lxkslwua64873453
145845,ENG CH,Middlesborough vs Leicester City,Over 1.5,?:?,2026-02-24,?,yxaahezc54633988
145846,ENG L2,Salford City vs Shrewsbury Town,Over 1.5,?:?,2026-02-24,?,sumckahr200435558
145848,ENG NL,Southend United vs Boreham Wood,Over 1.5,?:?,2026-02-24,?,befwmipe190042907
145849,ENG NL,Scunthorpe United vs York City FC,Over 1.5,?:?,2026-02-24,?,wdzutiad318607937
145851,Brazil: Paulista A2 - First Stage,Inter de Limeira vs Osasco Sporting,HOME DC,Not Yet,2026-02-24,Not Yet,ranchxpk179930021
145854,Spain: Tercera Rfef - Group 3,Selaya vs Guarnizo,AWAY DC,Not Yet,2026-02-24,Not Yet,gcjenvmb206238390
145855,Brazil: Paulista A2 - First Stage,Agua Santa vs Gremio Prudente,HOME DC,Not Yet,2026-02-24,Not Yet,jcrysbuz327474928
145856,Brazil: Paulista A2 - First Stage,Santo Andre vs Sertaozinho,HOME DC,Not Yet,2026-02-24,Not Yet,ntdhqfey5110550
145857,Egypt: Premier League,Al Masry vs Modern Sport,HOME DC,Not Yet,2026-02-24,Not Yet,snyowzzr206178194
145858,Argentina: Liga Profesional - Apertura,Velez Sarsfield vs Dep. Riestra,HOME DC,Not Yet,2026-02-24,Not Yet,htlufdxt296174996
145859,Thailand: Thai Fa Cup,Lamphun Warrior vs Bangkok Utd,AWAY DC,Not Yet,2026-02-24,Not Yet,olopevsm226621052
145861,Spain: Tercera Rfef - Group 3,Noja vs Vimenor,AWAY DC,Not Yet,2026-02-24,Not Yet,obnradut286600572
