ID,League,Fixture,Tip,Score,Match Date,Result,Code
146794,Morocco: Botola Pro,Wydad AC vs Berkane,HOME DC,?:?,2026-03-01,?,ktwomzfj253143478
146795,Argentina: Primera C,Deportivo Espanol vs Deportivo Muniz,HOME DC,?:?,2026-03-01,?,zzdtbxrb63907420
146796,Spain: Laliga,Betis vs Sevilla,HOME DC,?:?,2026-03-01,?,jmikybnj141249620
146804,USA: Mls,Philadelphia Union vs New York City,HOME DC,?:?,2026-03-01,?,pzitmbux286326529
146811,Germany: Bundesliga,Hamburger SV vs RB Leipzig,AWAY DC,?:?,2026-03-01,?,xuzivlxf180823279
146873,Czech Republic: Chance Liga,Sigma Olomouc vs Bohemians,HOME DC,?:?,2026-03-01,?,jcyzigju263777836
146876,Spain: Tercera Rfef - Group 13,Mazarron CF vs Ciudad Cieza,AWAY DC,?:?,2026-03-01,?,jdwtcswm122792964
146877,Romania: Superliga,UTA Arad vs FCSB,AWAY DC,?:?,2026-03-01,?,xdokosho160622335
146882,USA: Mls,Austin FC vs DC United,HOME DC,?:?,2026-03-01,?,llkfyspf13896601
146886,Belgium: Jupiler Pro League,Charleroi vs Club Brugge KV,AWAY DC,?:?,2026-03-01,?,jgyvirsx322426842
146891,Morocco: Botola Pro,Hassania Agadir vs Raja Casablanca,AWAY DC,?:?,2026-03-01,?,thybnctl149921670
146953,Argentina: Primera Nacional,Gimnasia Jujuy vs Quilmes,HOME DC,?:?,2026-03-01,?,qipixacr73058229
146954,Portugal: Liga Portugal,Rio Ave vs Famalicao,AWAY DC,?:?,2026-03-01,?,psutsien276919335
146955,Hungary: Nb I.,Puskas Academy vs Nyiregyhaza,HOME DC,?:?,2026-03-01,?,ksqywqbi55758330
146956,Spain: Tercera Rfef - Group 2,L'Entregu vs CD Colunga,HOME DC,?:?,2026-03-01,?,xizyqhzy64360178
146957,Montenegro: Prva Crnogorska Liga,Mornar Bar vs Mladost DG,HOME DC,?:?,2026-03-01,?,vjlgkgrg177021397
146958,Colombia: Primera A - Apertura,Aguilas vs Inter Bogotá,HOME DC,?:?,2026-03-01,?,jadyckvo328810376
146959,Argentina: Primera Nacional,San Martin T. vs Deportivo Maipu,HOME DC,?:?,2026-03-01,?,onkwqtsk113036115
146960,France: Ligue 1,Lorient vs Auxerre,HOME DC,?:?,2026-03-01,?,vurcgcsh139641342
146961,Spain: Tercera Rfef - Group 4,Real Sociedad C vs San Ignacio,HOME DC,?:?,2026-03-01,?,mhdzsyvp5096806
146962,Poland: Division 1,Odra Opole vs Stal Mielec,HOME DC,?:?,2026-03-01,?,hcemhwcv95412368
146963,Colombia: Primera A - Apertura,Aguilas vs Inter Bogotá,HOME DC,?:?,2026-03-01,?,fygmbnhq58742062
146964,Argentina: Primera Nacional,Gimnasia Jujuy vs Quilmes,HOME DC,?:?,2026-03-01,?,gqvrzkyu109467570
146965,Venezuela: Liga Futve 2,Miranda vs Aragua,HOME DC,?:?,2026-03-01,?,ertdkubx309191641
146966,Argentina: Primera C,Deportivo Espanol vs Deportivo Muniz,HOME DC,?:?,2026-03-01,?,ndkttxks226038223
146967,Portugal: Liga Portugal,Rio Ave vs Famalicao,AWAY DC,?:?,2026-03-01,?,kvjgvccz286276611
146968,Argentina: Primera Nacional,San Martin T. vs Deportivo Maipu,HOME DC,?:?,2026-03-01,?,oxzdtshh34662670
146969,France: Ligue 1,Marseille vs Lyon,HOME DC,?:?,2026-03-01,?,orafdgso227290891
146970,Spain: Laliga,Betis vs Sevilla,HOME DC,?:?,2026-03-01,?,ytlkdqic88335297
146971,Spain: Segunda Rfef - Group 5,Rayo Majadahonda vs Getafe B,HOME DC,?:?,2026-03-01,?,fbbyzfbe293260017
146972,Spain: Segunda Rfef - Group 4,Xerez CD vs Yeclano,HOME DC,?:?,2026-03-01,?,pkodzkua157338675
146973,Spain: Primera Rfef - Group 2,Algeciras vs Teruel,HOME DC,?:?,2026-03-01,?,vluyasfv77230511
146974,Spain: Tercera Rfef - Group 4,Real Sociedad C vs San Ignacio,HOME DC,?:?,2026-03-01,?,aqzquaxx299553155
146975,Czech Republic: Chance Liga,Sigma Olomouc vs Bohemians,HOME DC,?:?,2026-03-01,?,ezpwgxfd125612693
146976,Argentina: Primera Nacional,Racing Cordoba vs CA Mitre,HOME DC,?:?,2026-03-01,?,ugdksyfc66550010
146977,Morocco: Botola Pro,Wydad AC vs Berkane,HOME DC,?:?,2026-03-01,?,cgpcdufb42702471
146978,USA - MLS,Real Salt Lake vs Seattle Sounders,12,2 - 1,2026-03-01,Won,uzfcemtu18751097
146979,Venezuela - Primera,Dep. Tachira vs Metropolitanos,1X,0 - 1,2026-03-01,Lost,hdnwflnn7866547
146980,Costa Rica - Primera,Puntarenas vs LD Alajuelense,12,2 - 0,2026-03-01,Won,bpojtxea104677302
146981,USA - MLS,Dallas vs Nashville SC,12,0 - 0,2026-03-01,Lost,mgegbxuu13925368
146982,USA - MLS,Houston Dynamo vs Los Angeles FC,X2,0 - 2,2026-03-01,Won,ybdzwpfs28738586
146983,USA - MLS,LA Galaxy vs Charlotte FC,12,3 - 0,2026-03-01,Won,sxnwokmj298798177
146984,Japan - J2 League,Roasso Kumamoto vs Oita Trinita,12,3 - 1,2026-03-01,Won,odyzstst65761747
146985,Japan - J1 League,Fagiano Okayama vs Nagoya Grampus,X2,,2026-03-01,?,nhucszra196371468
146986,Japan - J2 League,Imabari vs Albirex Niigata,12,,2026-03-01,?,uxxseadr15064224
146987,Japan - J2 League,Kochi United vs Nara Club,1X,,2026-03-01,?,ngxsjcef118895132
146988,Japan - J2 League,Tochigi SC vs Yokohama FC,X2,,2026-03-01,?,rsyjbfyl3234723
146989,South Korea - K League 2,Chungbuk Cheongju vs Suwon FC,X2,,2026-03-01,?,rycethzm86299648
146990,China - Super Cup,Shanghai Port vs Beijing Guoan,12,,2026-03-01,?,gcdoxvrq22120123
146991,South Korea - K League 1,Jeju SK vs Gwangju,1X,,2026-03-01,?,ognanypd277442723
146992,South Korea - K League 2,Gyeongnam vs Jeonnam Dragons,12,,2026-03-01,?,gkxcyywj131180122
146993,Kenya - Premier League,Kenya Police vs Bandari,1X,,2026-03-01,?,esibmnyc120581293
146994,India - I-League,Dempo Goa vs Real Kashmir,12,,2026-03-01,?,hfvznfmh99014045
146995,Taiwan - Premier League,Hang Yuen vs Tainan City,12,,2026-03-01,?,jefpvron252420944
146996,Taiwan - Premier League,Tatung FC vs Taichung Futuro,X2,,2026-03-01,?,czfxumjd329528081
146997,Turkiye - TFF First League,Serik vs Sivasspor,12,,2026-03-01,?,rizgkojp23722246
146998,Spain - Primera RFEF - gr. 1,Arenas Club vs Barakaldo,X2,,2026-03-01,?,dgggfyhs275969279
146999,Spain - Primera RFEF - gr. 2,Ibiza vs Tarazona,1X,,2026-03-01,?,gecpmkmz233959103
147000,Ukraine - Premier,Kryvbas vs Zorya Luhansk,1X,,2026-03-01,?,tdyoxinh89322590
147001,Netherlands - Eredivisie,Zwolle vs Ajax,X2,,2026-03-01,?,ibpcflbn27294059
147002,Poland - Ekstraklasa,Termalica vs Radomiak Radom,X2,,2026-03-01,?,khxudbmr260623483
147003,Guatemala - Liga Nacional,Municipal vs Marquense,1,1 - 0,2026-03-01,Won,wdjdwdxh234302713
147004,Peru - Primera,Sport Boys vs Dep. Moquegua,1,0 - 0,2026-03-01,Lost,zlcepaad193670662
147005,El Salvador - Primera,Zacatecoluca FC vs Alianza Salvador,2,0 - 2,2026-03-01,Won,mxztmwxp261323615
147006,USA - MLS,Real Salt Lake vs Seattle Sounders,12,2 - 1,2026-03-01,Won,mmiobwgl218789550
147007,Costa Rica - Primera,Puntarenas vs LD Alajuelense,12,2 - 0,2026-03-01,Won,iadfjryg28454679
147008,Mexico - Liga MX,Monterrey vs Cruz Azul,X2,0 - 2,2026-03-01,Won,igfhocow10664478
147009,Argentina - Liga Profesional,Talleres vs San Lorenzo,12,0 - 0,2026-03-01,Lost,idkmixin179418781
147010,USA - MLS,Dallas vs Nashville SC,12,0 - 0,2026-03-01,Lost,wnxyttrv113263669
147011,USA - MLS,Houston Dynamo vs Los Angeles FC,X2,0 - 2,2026-03-01,Won,hbdrmxil254096835
147012,Costa Rica - Primera,Herediano vs Perez Zeledon,1,3 - 0,2026-03-01,Won,rkwotiub113898
147013,USA - MLS,V. Whitecaps vs Toronto,1,3 - 0,2026-03-01,Won,cctrpnto191883255
147014,USA - MLS,LA Galaxy vs Charlotte FC,12,3 - 0,2026-03-01,Won,pgupqibh133188893
147015,Japan - J2 League,Roasso Kumamoto vs Oita Trinita,12,3 - 1,2026-03-01,Won,qkreytcb175206821
147016,Japan - J1 League,Fagiano Okayama vs Nagoya Grampus,X2,,2026-03-01,?,cjxwisup262066100
147017,Japan - J2 League,Imabari vs Albirex Niigata,12,,2026-03-01,?,tkpewhpk24109497
147018,Japan - J2 League,Kochi United vs Nara Club,1X,,2026-03-01,?,cgntynge211109766
147019,Japan - J2 League,Tochigi SC vs Yokohama FC,X2,,2026-03-01,?,sfcirttp298909315
147020,South Korea - K League 1,Jeonbuk Motors vs Bucheon 1995,1,,2026-03-01,?,xyszqmbz134958409
147021,South Korea - K League 2,Chungbuk Cheongju vs Suwon FC,X2,,2026-03-01,?,sgkbgcmp53707136
147022,Japan - J1 League,Kawasaki Front. vs Mito HollyHock,1X,,2026-03-01,?,hdgldhmk287324375
147023,China - Super Cup,Shanghai Port vs Beijing Guoan,12,,2026-03-01,?,hjoorbov228699441
147024,South Korea - K League 1,Jeju SK vs Gwangju,1X,,2026-03-01,?,qawdtihj177527525
147025,South Korea - K League 2,Gyeongnam vs Jeonnam Dragons,12,,2026-03-01,?,ifcovdgg271099000
147026,Taiwan - Premier League,Taipower vs Ming Chuan Univ.,1,,2026-03-01,?,dhhgzwhk282990381
147027,Russia - First League,Yenisey vs Volga Ulyanovsk,1X,,2026-03-01,?,xzqwzika177863303
147028,NED Eredivisie,PEC Zwolle vs Ajax,Over 1.5,?:?,2026-03-01,?,mlhnyhay6648618
147029,SCT D1,Rangers vs Celtic FC,Over 1.5,?:?,2026-03-01,?,bdzfqjqd247879735
147030,GER D2,Hertha BSC vs FC Nuremberg,Over 1.5,?:?,2026-03-01,?,cksxrmwa147884825
147031,GER D2,FC Magdeburg vs Karlsruher SC,Over 1.5,?:?,2026-03-01,?,plsmfizv261882458
147032,EPL,Manchester United vs Crystal Palace,Over 1.5,?:?,2026-03-01,?,dxjcqnoh120138134
147033,Bundesliga,VFB Stuttgart vs VFL Wolfsburg,Over 1.5,?:?,2026-03-01,?,wdhbirav308694426
147034,BELG D1,KVC Westerlo vs Union Saint Gilloise,Over 1.5,?:?,2026-03-01,?,bcdnsvqv256030313
147035,SWT D1,Young Boys vs FC Zurich,Over 1.5,?:?,2026-03-01,?,sfmogpqr319604606
147036,AUST D1,RB Salzburg vs Hartberg,Over 1.5,?:?,2026-03-01,?,rrmieahn111348676
147257,France: Ligue 2,Amiens vs Troyes,AWAY DC,?:?,2026-03-01,?,cimbbiqx193024063
147259,Indonesia: Super League,Persebaya vs Persib Bandung,AWAY DC,?:?,2026-03-01,?,tyfmyuoq3548257
147297,Serbia - SuperLiga,IMT New Belgrade vs Radnik Surdulica,X2,,2026-03-01,?,sgbmwckw266949577
147314,Ukraine: Premier League,SC Poltava vs Kudrivka,AWAY DC,?:?,2026-03-01,?,itepqnyd98068158
147315,Turkey: 1. Lig,Manisa FK vs Corum,AWAY DC,?:?,2026-03-01,?,ugxlwdis313974821
147316,Indonesia: Super League,PSM Makassar vs Persita,HOME DC,?:?,2026-03-01,?,leruhteb958427
147317,Italy: Serie A,Pisa vs Bologna,AWAY DC,?:?,2026-03-01,?,obphgoii268428233
147318,Ireland: Premier Division,St. Patricks vs Galway,HOME DC,?:?,2026-03-01,?,xtwpjztj46555199
147319,Ireland: Premier Division,St. Patricks vs Galway,HOME DC,?:?,2026-03-01,?,hvuemxlc227389014
147320,France: Ligue 2,Amiens vs Troyes,AWAY DC,?:?,2026-03-01,?,iqzwbbpj230475482
147321,Turkey: 1. Lig,Manisa FK vs Corum,AWAY DC,?:?,2026-03-01,?,ofpfcvev189452887
147322,Italy: Serie A,Pisa vs Bologna,AWAY DC,?:?,2026-03-01,?,rzcengug57899043
147323,Indonesia: Super League,Persebaya vs Persib Bandung,AWAY DC,?:?,2026-03-01,?,bdjynbay23535005
147324,Indonesia: Super League,PSM Makassar vs Persita,HOME DC,?:?,2026-03-01,?,sbkfbqpy73058305
147325,Ukraine: Premier League,SC Poltava vs Kudrivka,AWAY DC,?:?,2026-03-01,?,gpispoxi15277354
147326,USA - MLS,Orlando City vs Inter Miami,12,2 - 4,2026-03-01,Won,kkubsmxm233152017
147327,Argentina - Liga Profesional,Def. Y Justicia vs Lanus,1X,1 - 1,2026-03-01,Won,iacaukrz169790405
147328,Honduras - Liga Nacional,Platense vs Real Espana,X2,2 - 2,2026-03-01,Won,hubwqfjd304657535
147329,Kenya - Premier League,Bidco United vs Ulinzi Stars,12,,2026-03-01,?,kstreyjy260463578
147330,Bulgaria - First PFL,Ludogorets vs Lokomotiv Pd,1,,2026-03-01,?,bkihuvps183566065
147331,Cameroon - Elite One,Colombe vs Stade Renard,1X,,2026-03-01,?,slyrpdgt24083604
147332,Georgia - Premier,Gagra vs Samgurali,12,,2026-03-01,?,hkodcwtu324544191
147333,Russia - First League,Rodina Moscow vs Shinnik Yaroslavl,1X,,2026-03-01,?,pjuddcik7543622
147334,Poland - First League,Wieczysta Krakow vs Polonia Warszawa,1X,,2026-03-01,?,kdrzuhnw314308514
147335,Poland - Ekstraklasa,Zaglebie Lubin vs Wisla Plock,1X,,2026-03-01,?,qqfkzeby40672436
147336,Portugal - Liga Portugal 2,Feirense vs Felgueiras 1932,1X,,2026-03-01,?,zagbwbzt177568649
147337,Netherlands - Eerste Divisie,Emmen vs Jong Utrecht,1X,,2026-03-01,?,jlbnkgap139133878
147338,Egypt - Premier,Al Ittihad vs Ghazl El Mahalla,1X,,2026-03-01,?,lqyplekk230030869
147339,Egypt - Premier,Pharco vs Kahraba Ismailia,X2,,2026-03-01,?,zfdpoykh257704880
147340,Argentina - Liga Profesional,Dep. Riestra vs Platense,1X,,2026-03-01,?,fhvbvrmj56976815
147341,Argentina - Liga Profesional,Estudiantes LP vs Velez Sarsfield,1X,,2026-03-01,?,txzgptfy14720393
147342,Guatemala - Liga Nacional,Xelaju MC vs Dep. Mictlan,1,2 - 0,2026-03-01,Won,festckvq227154490
147343,USA - MLS,Orlando City vs Inter Miami,12,2 - 4,2026-03-01,Won,budfhpyx25372457
147344,Argentina - Liga Profesional,Def. Y Justicia vs Lanus,1X,1 - 1,2026-03-01,Won,hzjazven237443297
147345,Costa Rica - Primera,San Carlos vs Cartagines,1X,1 - 1,2026-03-01,Won,tjgnpypy43423333
147346,Colombia - Primera A,Deportes Tolima vs Atl. Nacional,12,1 - 0,2026-03-01,Won,uhmgajzx101209651
147347,Honduras - Liga Nacional,Platense vs Real Espana,X2,2 - 2,2026-03-01,Won,kzdrnvei77503503
147348,Kenya - Premier League,Bidco United vs Ulinzi Stars,12,,2026-03-01,?,wveogmyq73751114
147349,Kenya - Premier League,Kakamega Homeboyz vs APS Bomet,1X,,2026-03-01,?,mftgwrhy21461862
147350,Indonesia - Super League,Persebaya vs Persib Bandung,X2,,2026-03-01,?,kyumkjdq198636085
147351,Bulgaria - First PFL,Ludogorets vs Lokomotiv Pd,1,,2026-03-01,?,ypbeuhal27609922
147352,Cameroon - Elite One,Colombe vs Stade Renard,1X,,2026-03-01,?,tuwboufi96630844
147353,Georgia - Premier,Gagra vs Samgurali,12,,2026-03-01,?,dtzlwmvu4994445
147354,Russia - First League,Rodina Moscow vs Shinnik Yaroslavl,1X,,2026-03-01,?,dsnsnrce260588727
147355,Cyprus - First Division,Omonia Nicosia vs Apollon Limassol,1X,,2026-03-01,?,bjvmgsun150118283
147356,Israel - Liga Leumit,Hapoel Hadera vs Kiryat Yam,X2,,2026-03-01,?,qzqccyzn312572137
147357,Poland - First League,Wieczysta Krakow vs Polonia Warszawa,1X,,2026-03-01,?,juanxlus237266749
147358,Turkiye - TFF First League,Manisa vs Corum,X2,,2026-03-01,?,oogzffxw248879836
147359,Romania - Liga I,Unirea Slobozia vs Rapid Bucuresti,2,,2026-03-01,?,jhuknyyy41575973
147360,Israel - Liga Leumit,Kafr Qasim vs M. Herzliya,X2,,2026-03-01,?,dfrmwqup129238028
147361,Poland - Ekstraklasa,Zaglebie Lubin vs Wisla Plock,1X,,2026-03-01,?,rxdugmlg167579431
147362,Portugal - Liga Portugal 2,Feirense vs Felgueiras 1932,1X,,2026-03-01,?,gjlgkktp255067425
147363,Sweden - Svenska Cupen,Orebro vs Hammarby,2,,2026-03-01,?,cuxcjwim5153277
147364,Sweden - Svenska Cupen,Sandviken vs GAIS Goteborg,2,,2026-03-01,?,xyounxpf280797239
147365,Israel - Premier,Hapoel Tel Aviv vs Maccabi Haifa,1X,,2026-03-01,?,ffbgcont30429407
147366,Netherlands - Eerste Divisie,Emmen vs Jong Utrecht,1X,,2026-03-01,?,sysftbsg61946485
147367,MLS,Orlando City SC vs Inter Miami,Over 1.5,?:?,2026-03-01,?,clkmphdx36826919
147368,MLS,San Diego FC vs Saint Louis City,Over 1.5,?:?,2026-03-01,?,rfwimlia248953787
147369,TURK D2,Manisa FK vs Corum FK,Over 1.5,?:?,2026-03-01,?,vjafqqss265334389
147370,POL D2,Wieczysta Krakow vs Polonia Warszawa,Over 1.5,?:?,2026-03-01,?,nokzbngh54771911
147371,La Liga 2,Cordoba CF vs FC Andorra,Over 1.5,?:?,2026-03-01,?,nmbnszuw107734905
